{
  "version": 1,
  "mandatorySafetyRules": [
    {
      "id": "correctness_over_speed",
      "statement": "Correctness over speed for critical domains.",
      "requiredInRuntimeContext": true
    },
    {
      "id": "server_side_authority",
      "statement": "Sensitive authority remains server-side for critical boundaries.",
      "requiredInRuntimeContext": true
    },
    {
      "id": "no_fake_success_paths",
      "statement": "Never fabricate production success-path behavior.",
      "requiredInRuntimeContext": true
    },
    {
      "id": "shared_contracts_are_canonical",
      "statement": "Shared contracts and primitives are canonical where applicable.",
      "requiredInRuntimeContext": true
    },
    {
      "id": "docs_are_part_of_done",
      "statement": "Architecture, invariant, and user-visible changes must update canonical docs in the same change.",
      "requiredInRuntimeContext": true
    },
    {
      "id": "no_destructive_git_without_instruction",
      "statement": "Never run destructive git/file commands without explicit written instruction.",
      "requiredInRuntimeContext": true
    }
  ],
  "roleContracts": {
    "planner": {
      "sandboxMode": "read-only",
      "reasoningEffort": "medium",
      "intent": "Turn user intent into decision-complete future slices."
    },
    "explorer": {
      "sandboxMode": "read-only",
      "reasoningEffort": "medium",
      "intent": "Trace risky surfaces and dependencies before implementation when planning needs more facts."
    },
    "worker": {
      "sandboxMode": "full-access",
      "reasoningEffort": "high",
      "intent": "Implement one active slice and keep plan, docs, and evidence aligned."
    },
    "reviewer": {
      "sandboxMode": "read-only",
      "reasoningEffort": "high",
      "intent": "Review medium/high-risk slices for correctness, regressions, and missing scope before validation."
    }
  },
  "validationPolicy": {
    "fastIteration": [
      "node ./scripts/automation/compile-runtime-context.mjs",
      "node ./scripts/docs/check-governance.mjs",
      "node ./scripts/automation/check-plan-metadata.mjs",
      "node ./scripts/automation/check-harness-alignment.mjs"
    ],
    "fullGate": [
      "node ./scripts/automation/compile-runtime-context.mjs",
      "node ./scripts/docs/check-governance.mjs",
      "node ./scripts/check-article-conformance.mjs",
      "node ./scripts/architecture/check-dependencies.mjs",
      "node ./scripts/agent-hardening/check-agent-hardening.mjs",
      "node ./scripts/agent-hardening/check-evals.mjs",
      "node ./scripts/automation/check-harness-alignment.mjs",
      "node ./scripts/automation/check-plan-metadata.mjs"
    ],
    "notes": "Fast iteration commands are minimum-safe defaults. Full gate commands remain required before merge."
  },
  "memoryPosture": {
    "whatToDo": [
      "Treat the repo as the main operating system for agent work.",
      "Keep plans, evidence, docs, code, and validation output as the source of truth.",
      "Treat `## Must-Land Checklist` as the execution contract and keep `## Already-True Baseline`, `## Must-Land Checklist`, and `## Deferred Follow-Ons` separate.",
      "Use repo-local checkpoints, explicit handoffs, evidence indexes, and resumable orchestration as the default memory system.",
      "Keep context selective: load current scope, latest checkpoint, latest handoff, and relevant evidence; persist distilled findings, not raw session history."
    ],
    "improveBeforeRearchitecture": [
      "Better checkpoint contents.",
      "Better handoff notes.",
      "Better evidence compaction.",
      "Better validation and observability.",
      "Fix plan quality before widening the memory system."
    ],
    "doNotAddYet": [
      "Do not add external retrieval just because work is long.",
      "Do not add provider-thread persistence just because context is limited.",
      "Do not move important working memory outside the repo while repo-local continuity is sufficient.",
      "Do not treat extra memory systems as a substitute for better plans, checkpoints, and handoffs."
    ],
    "escalateWhen": [
      "Agents repeatedly miss important context even though it exists.",
      "Repo-local checkpoints and handoffs stop being enough.",
      "Important memory starts living outside the repo.",
      "You need one agent to search across many unrelated systems.",
      "You can point to repeated failures, not just a vague worry."
    ],
    "safeRule": "If repo-local plans, checkpoints, and handoffs are enough, keep this design. If important context lives outside the repo and agents keep missing it, then consider external retrieval."
  },
  "docContract": {
    "canonicalEntryPoints": [
      "AGENTS.md",
      "README.md",
      "ARCHITECTURE.md",
      "docs/MANIFEST.md"
    ],
    "requiresSameChangeUpdateFor": [
      "architecture boundaries",
      "critical invariants",
      "security/compliance behavior",
      "user-visible behavior"
    ]
  },
  "gitSafetyContract": {
    "forbiddenWithoutExplicitInstruction": [
      "git reset --hard",
      "git checkout -- <path>",
      "rm -rf",
      "git clean -fd"
    ],
    "notes": "Do not edit .env files or switch branches/worktrees unless explicitly requested in-thread."
  }
}
